Timestamp,Email Address,Media Source URL,1-8 word Summary,(Annotated) Screenshot,Start Time,End Time,Keywords (comma separated),Comments,Meta Level Comment?
2/24/2021 12:29:06,jduval@ucsc.edu,https://www.youtube.com/watch?v=B1sWtT-wShI&list=PL7-KcWQGzCOvbNg2bszlRSAfDa6o_4ziJ&index=3,Polished Intro,https://drive.google.com/open?id=1FnSYNTAkNOopQ5YV6dB7-bQOsyDXFahf,12:00:00 AM,12:13:00 AM,"Video Polish, Closed Captioning","The intro of the video was clearly edited with high polish. There is a logo, a separate narrator, and clean closed captioning that includes cues beyond what is spoken.",
2/24/2021 13:29:10,kringlan@ucsc.edu,https://youtu.be/B1sWtT-wShI,The Power of Choice - London Episode 2 Part 1,,12:08:00 AM,,accessibility,they are giving audio descriptions of the main activity happening in the video (this happens throughout the video),
2/24/2021 12:35:59,jduval@ucsc.edu,https://www.youtube.com/watch?v=B1sWtT-wShI&list=PL7-KcWQGzCOvbNg2bszlRSAfDa6o_4ziJ&index=3,Debunking personal assumption,https://drive.google.com/open?id=1lA9RwkLQen-3zZTEBdL5RvniRkvc_7Uc,12:12:00 AM,12:18:00 AM,"Debunking assumption, time management, travel",I got instant anxiety when I saw that it was 7:30 and the flight leaves at 9:50pm. I (wrongly) assumed that someone who is blind might schedule in extra time to travel on public transportation to the airport. (I would be uncomfortable myself with this timeline) I am unsure how long the train ride is though. She goes on to describe that she is comfortable with this subway and has used it since high school.,
2/24/2021 12:13:32,bbaltaxe@ucsc.edu,https://www.youtube.com/watch?v=B1sWtT-wShI&list=PL7-KcWQGzCOvbNg2bszlRSAfDa6o_4ziJ&index=3,The Power of Choice - London Episode 2 Part 1,,12:20:00 AM,12:25:00 AM,"Comfort, learning areas, navigation","""I'm really comfortable with this area, I've been walking through these subway stations since I was in high school"" 

Comfort in this area is a good thing - 
- takes time to learn areas 
- signifies that there's other areas she hasn't known for a long time and may not be comfortable in ",
2/24/2021 12:38:40,jduval@ucsc.edu,https://www.youtube.com/watch?v=B1sWtT-wShI&list=PL7-KcWQGzCOvbNg2bszlRSAfDa6o_4ziJ&index=3,Closed Captioning Accessibility issue,https://drive.google.com/open?id=1wYl-6a06osxjw-HOKG-g7ozJvEPWTICd,12:31:00 AM,12:31:00 AM,"Closed Caption, Accessibility, Video",The closed captioning overlaps the lower thirds information. ,
2/24/2021 12:26:09,bbaltaxe@ucsc.edu,https://www.youtube.com/watch?v=B1sWtT-wShI&list=PL7-KcWQGzCOvbNg2bszlRSAfDa6o_4ziJ&index=3,The Power of Choice - London Episode 2 Part 1,https://drive.google.com/open?id=1B_opffV0-7Vc2ssxXvmpx37aNUSDR2uv,12:35:00 AM,,"Time, Reliance, Planning","Needing to rely on public trasportation means that you don't have much control over when you get places and need to have a backup plan

This video also seems very centered around the idea of time. The timer in the bottom right of the video keeps us thinking about how long each step takes. ",
2/24/2021 12:29:09,bbaltaxe@ucsc.edu,https://www.youtube.com/watch?v=B1sWtT-wShI&list=PL7-KcWQGzCOvbNg2bszlRSAfDa6o_4ziJ&index=3,The Power of Choice - London Episode 2 Part 1,,12:35:00 AM,,"Together, competency ","Mona seems to be traveling with two others (and the camera man) I wonder what their relation is

They follow her. There seems to be a built in understanding of trust and confidence ",
2/24/2021 12:44:51,jduval@ucsc.edu,https://www.youtube.com/watch?v=B1sWtT-wShI&list=PL7-KcWQGzCOvbNg2bszlRSAfDa6o_4ziJ&index=3,Train Delayed,https://drive.google.com/open?id=1QFE4o_N_adP5VIORQaauyEJPFbTdzGvU,12:35:00 AM,12:35:00 AM,"Train Delay, Closed Captioning, Video Editing",I felt sympathetic anxiety for when the train was delayed. I appreciate that the closed captions were not included for spoken text that was video edited as text for a dramatic effect. ,
2/24/2021 12:47:12,jduval@ucsc.edu,https://www.youtube.com/watch?v=B1sWtT-wShI&list=PL7-KcWQGzCOvbNg2bszlRSAfDa6o_4ziJ&index=3,Narrator,https://drive.google.com/open?id=13niKQ_BHWDZGoGJsdgHezhbfvSMcR_ev,12:44:00 AM,12:44:00 AM,"Narrator, Polish, Video Effects",The narrator provides nice background context that contrasts the moment-to-moment think aloud from the person with vision impairment.,
2/24/2021 12:34:03,bbaltaxe@ucsc.edu,https://www.youtube.com/watch?v=B1sWtT-wShI&list=PL7-KcWQGzCOvbNg2bszlRSAfDa6o_4ziJ&index=3,The Power of Choice - London Episode 2 Part 1,,12:56:00 AM,1:00:00 AM,"Asking directions, mental model ","The task comment makes it seem like there's an objective. I wonder if this is something that Mona decided to include or something in editing. Is her mental model task based? 

She asks the clerk very specific wording ""ok do you know like after security is it right or left?"" instead of ""which way."" you can see the clerk thinking about how to connect the direction to the word. She even still points. ",
2/24/2021 12:55:21,jduval@ucsc.edu,https://www.youtube.com/watch?v=B1sWtT-wShI&list=PL7-KcWQGzCOvbNg2bszlRSAfDa6o_4ziJ&index=3,Asking for Directions,https://drive.google.com/open?id=1yhUffcGVFtRRAVhXszWs1KMaBSB1pW7G,1:00:00 AM,1:00:00 AM,"Navigation, Directions, Assistance ",Asked stewardess for directions to gate.,
2/24/2021 12:57:13,jduval@ucsc.edu,https://www.youtube.com/watch?v=B1sWtT-wShI&list=PL7-KcWQGzCOvbNg2bszlRSAfDa6o_4ziJ&index=3,To The Right,https://drive.google.com/open?id=18wOkHAaPHfwlXfk0pAvIv9KLf9LicajD,1:04:00 AM,,"Music, Video Editing, Polish","""To the Right"" song played and I thought to myself, ""I wonder if she uses songs and other pneumatics to remember navigation instructions""",
2/24/2021 13:26:20,jduval@ucsc.edu,https://www.youtube.com/watch?v=B1sWtT-wShI&list=PL7-KcWQGzCOvbNg2bszlRSAfDa6o_4ziJ&index=3,Lost at gate,https://drive.google.com/open?id=1ANRX03TflD2DLYOvLQU8hX4pgerdz4aK,1:07:00 AM,,"Lost, Assistance, Navigation",Got lost looking for gate and continued straight anyway. Seemed comfortable asking strangers for help. No one has offered yet based on blind cane. Multiple people answered along the way and gave conflicting information.,
2/24/2021 13:35:45,kringlan@ucsc.edu,https://youtu.be/B1sWtT-wShI,The Power of Choice - London Episode 2 Part 1,https://drive.google.com/open?id=1YkbSDS5-yTgCjRZtfIKOqWOJZuIZdkMd,1:16:00 AM,,"assistance, directions","asking for directions, video shows lots of people pointing for directions but have a harder time verbalizing",
2/24/2021 13:39:16,bbaltaxe@ucsc.edu,https://www.youtube.com/watch?v=B1sWtT-wShI&list=PL7-KcWQGzCOvbNg2bszlRSAfDa6o_4ziJ&index=3,The Power of Choice - London Episode 2 Part 1,,1:34:00 AM,2:19:00 AM,"assistance, ",Why are pedestrians so much nicer at helping people than workers,
2/24/2021 12:40:02,bbaltaxe@ucsc.edu,https://www.youtube.com/watch?v=B1sWtT-wShI&list=PL7-KcWQGzCOvbNg2bszlRSAfDa6o_4ziJ&index=3,The Power of Choice - London Episode 2 Part 1,,1:40:00 AM,,Reliance on others,"All signage is visual, need to depend on asking for other's help.. others are not great at giving directions. ",
2/24/2021 13:28:54,jduval@ucsc.edu,https://www.youtube.com/watch?v=B1sWtT-wShI&list=PL7-KcWQGzCOvbNg2bszlRSAfDa6o_4ziJ&index=3,Airplane sound,https://drive.google.com/open?id=1YMuBdSRfjR7KKII99csiiQEg4IdaeM9D,1:54:00 AM,,"Video Editing, Sound effects, Narrative, Polish",Nice use of blackout and sound effect to mark the end of a story beat and give some breathing room. Great storytelling and video polish.,
2/24/2021 12:45:10,bbaltaxe@ucsc.edu, https://www.youtube.com/watch?v=B1sWtT-wShI&list=PL7-KcWQGzCOvbNg2bszlRSAfDa6o_4ziJ&index=3,The Power of Choice - London Episode 2 Part 1,,2:00:00 AM,2:30:00 AM,ableism,"She talks in a hushed voice about not being given the safety demonstration. I wonder if this is because someone is sleeping nearby or because she doesn't want anyone to know what they are talking about. 

It's funny that someone could be so ableist in a direct manner, but she chooses not to be direct back and speaks in a hushed tone. ",
2/24/2021 13:30:50,jduval@ucsc.edu,https://www.youtube.com/watch?v=B1sWtT-wShI&list=PL7-KcWQGzCOvbNg2bszlRSAfDa6o_4ziJ&index=3,No Safety Demo !?!?,https://drive.google.com/open?id=1FdBnNXjzajlmWocmoy0MquWSqPhxwBAf,2:09:00 AM,,Anger,"How is it ok that because an assistant is present, she is excluded from getting a safety demonstration!?!?",
2/24/2021 13:32:39,jduval@ucsc.edu,https://www.youtube.com/watch?v=B1sWtT-wShI&list=PL7-KcWQGzCOvbNg2bszlRSAfDa6o_4ziJ&index=3,Chapter demarkation ,https://drive.google.com/open?id=1inEJ2wetRAHD1d_Fb25kHc-dnJ2BP_3T,2:40:00 AM,,"Video polish, effects, chapter","I appreciate how the video represents a journey broken into ""chapters""",
2/24/2021 12:47:33,bbaltaxe@ucsc.edu,https://www.youtube.com/watch?v=B1sWtT-wShI&list=PL7-KcWQGzCOvbNg2bszlRSAfDa6o_4ziJ&index=3,The Power of Choice - London Episode 2 Part 1,,2:50:00 AM,3:15:00 AM,Over assistance,Mona is very clear about how she wants assistance (just directions) but the lady asks her again is she wants to be assisted after giving her directions ,
2/24/2021 13:35:36,jduval@ucsc.edu,https://www.youtube.com/watch?v=B1sWtT-wShI&list=PL7-KcWQGzCOvbNg2bszlRSAfDa6o_4ziJ&index=3,Song again,https://drive.google.com/open?id=1fWlnr2UHzxIC73qP5cx9ZAFo0btXIzPC,3:00:00 AM,,"Sound Effect, Video Editing, Polish",Got directions for disembarking. Narrator commented on some obstacles such as the bag getting caught. ,
2/24/2021 13:38:15,jduval@ucsc.edu,https://www.youtube.com/watch?v=B1sWtT-wShI&list=PL7-KcWQGzCOvbNg2bszlRSAfDa6o_4ziJ&index=3,Politely offering assistance,https://drive.google.com/open?id=1gM5BHjVRDjXGOzm7C54BOLedex-OtIOA,3:14:00 AM,,"Assistance, Polite",Person with visual impairment initiated conversation and got directions. Then assistant offered to guide and person with visual impairment politely declined.,
2/24/2021 12:59:09,bbaltaxe@ucsc.edu,https://www.youtube.com/watch?v=B1sWtT-wShI&list=PL7-KcWQGzCOvbNg2bszlRSAfDa6o_4ziJ&index=3,The Power of Choice - London Episode 2 Part 1,,3:20:00 AM,4:06:00 AM,"Assistance norms, assumptions about roles",Interesting that they have to think about how to film to get people's normal reactions. People around her are assuming that her friend who is filming is there to assist her. Makes me curious about the way society frames kinship for pwds,
2/24/2021 13:47:03,bbaltaxe@ucsc.edu,https://www.youtube.com/watch?v=B1sWtT-wShI&list=PL7-KcWQGzCOvbNg2bszlRSAfDa6o_4ziJ&index=3,The Power of Choice - London Episode 2 Part 1,,3:35:00 AM,,body language,This guy never looks up from his phone but is really kind and helpful so? it's fine? interesting though. Assumptions about seeing maybe? ,
2/24/2021 13:40:19,jduval@ucsc.edu,https://www.youtube.com/watch?v=B1sWtT-wShI&list=PL7-KcWQGzCOvbNg2bszlRSAfDa6o_4ziJ&index=3,Natalie changed peoples behavior,https://drive.google.com/open?id=1HdhFhEaV-_Fuab-hIVudES2U9w-fsl0f,3:46:00 AM,,"Assistant, Camera",People assumed that the camera person was her assistant and refused to help due to her presence...,
2/24/2021 13:43:24,jduval@ucsc.edu,https://www.youtube.com/watch?v=B1sWtT-wShI&list=PL7-KcWQGzCOvbNg2bszlRSAfDa6o_4ziJ&index=3,Disclosed disability ,https://drive.google.com/open?id=1u70gJ-5zU-7PGkSJ8YmpqmVWWaPQHjhq,4:27:00 AM,,"Disclosed disability, frustrated, decline assistance","The worker declined to help because he was in his post and she had to disclose her disability, but he still offered little help.",
2/24/2021 13:55:08,bbaltaxe@ucsc.edu,https://www.youtube.com/watch?v=B1sWtT-wShI&list=PL7-KcWQGzCOvbNg2bszlRSAfDa6o_4ziJ&index=3,The Power of Choice - London Episode 2 Part 1,,4:55:00 AM,5:15:00 AM,"Visual descriptions, Access intimacy ","This is a really nice moment where the video recorder describes a cake to Mona without any instructions or ask to do so. She knows just how to describe it and you can tell that this is a comfortable, normal interaction for them. 

Also what a lovely cake. They talk about the cake but never mention who it is from. I don't think that the video specifically says she's sponsered by anyone or there for a conference or anything, perhaps it's in the description. 
",
2/24/2021 13:27:04,bbaltaxe@ucsc.edu,https://www.youtube.com/watch?v=B1sWtT-wShI&list=PL7-KcWQGzCOvbNg2bszlRSAfDa6o_4ziJ&index=3,The Power of Choice - London Episode 2 Part 1,,7:00:00 AM,,"ableism, assumptions, patronizing, bystanders ","Mona asks metro employee to help buy her a ticket. He won't let her go alone and doesn't help. Escalates it to maybe a manager? 

manager guy tells mona ""you just relax, a member of staff will escort you to the train."" that's not at all what she asked for. She is calm, and the word 'relax' makes me feel like he thinks she is doing something wrong or conflates her asking for help with anger. Being a woman with a disability asking for help is automatically registered as her having a problem. 

PWDs have to try especially hard not to come off as angry for access reasons. 

He is really talking down to her. She says she's a professor to prove her competence and he says ""congratulations"" 

People look on but don't do anything 

""I'll keep the member of staff out of your video."" He doesn't even recognize that she is being asked to be seen as a human, just that she's making a video
",
2/24/2021 13:34:51,bbaltaxe@ucsc.edu,https://www.youtube.com/watch?v=B1sWtT-wShI&list=PL7-KcWQGzCOvbNg2bszlRSAfDa6o_4ziJ&index=3,The Power of Choice - London Episode 2 Part 1,,,,"disability culture, forced intimacy, refusal ","So it seems like it [receiving forced assistance?] is the cultural default but you do have a choice. And it seems like that's not culturally what people think or enforce at all because last time I traveled the same thing happened. So let's see. If I refuse help let's see what happens.  

This is the second or third time she's brought up culture. Earlier mention of exploring disability culture in london. Also earlier she says something like, I guess people aren't used to helping people who ask here. 

She sees exploring disability culture in London as one of the main points of this video so that's something we should be sure to make note of ",
2/24/2021 13:51:28,bbaltaxe@ucsc.edu,https://www.youtube.com/watch?v=B1sWtT-wShI&list=PL7-KcWQGzCOvbNg2bszlRSAfDa6o_4ziJ&index=3,The Power of Choice - London Episode 2 Part 1,,,,"Technology, planning","""uh oh"" 

She is clearly frustrated with Siri (facial expression and ""It FINALLY worked!"". Why does siri read so slow when the screen reader is so fast? Another instance of moving slower due to reliance on things out of your control (bus delays, service outages). 

The scenes are all cut after uh oh. I wonder if she has to ask again each time? Or if it automatically trys again. ",
3/3/2021 10:34:02,kringlan@ucsc.edu,https://youtu.be/B1sWtT-wShI,Fun Singing,,0:00:08,,"culture reference, fun, humor","She's singing about Carmen Sandiego which gives lots of cultural reference - dates her, means something to me as an audience member who remembers that - shows she's fun and there will be light moments in this video",
3/3/2021 10:36:53,kringlan@ucsc.edu,https://youtu.be/B1sWtT-wShI,Polished Video,,0:00:00,,"edited video, polished video",the video looks professional with the editing which might add to its legitimacy?,
3/3/2021 10:38:52,kringlan@ucsc.edu,https://youtu.be/B1sWtT-wShI,Waiting for Train Talking about Past Experience,,0:00:22,,"past experiences, expertise","She mentions she's been using public transport since high school, giving us a history and understanding of her expertise",
3/3/2021 10:39:45,kringlan@ucsc.edu,https://youtu.be/B1sWtT-wShI,Calculating Speed of Train,,0:00:25,,expertise,Again shows her expertise in public transport being able to calculate when a particular train will arrive/get her to her destination,
3/3/2021 10:47:01,kringlan@ucsc.edu,https://youtu.be/B1sWtT-wShI,Asking for directions,,0:00:56,,"ask for directions, specific directions","Asks specifically if it's left or right after security to get directions, woman clearly has to think for a second to remember before giving answer",
3/3/2021 10:59:43,kringlan@ucsc.edu,https://youtu.be/B1sWtT-wShI,Ticket Person Waves at Camera,https://drive.google.com/open?id=1od4OlD834jAC9FT9q2OauNTigu6v4dGZ,0:01:00,,"acknowledges camera, assistant",Ticket person waves and smiles to the camera person,
3/3/2021 11:10:42,kringlan@ucsc.edu,https://youtu.be/B1sWtT-wShI,Flight attendant no safety demo,,0:01:59,,"assistant, unclear rules, ableism",Flight attendant won't give safety demo because has an assistant with her? (Does that even make sense??),
3/3/2021 11:12:15,kringlan@ucsc.edu,https://youtu.be/B1sWtT-wShI,Compare Delta to Current Airline Experience,,0:02:21,,"assistant, unclear rules, ableism, compare experiences, past experiences","""When we flew to Johannesburg on Delta like they still gave me the safety demonstration""",
3/3/2021 11:13:34,kringlan@ucsc.edu,https://youtu.be/B1sWtT-wShI,Mentions Culture of Disability,,0:02:30,,disability culture,"Mentions disability culture: ""we're gonna explore the culture of disability there [London]""",
3/3/2021 11:15:22,kringlan@ucsc.edu,https://youtu.be/B1sWtT-wShI,Detailed directions at terminal in Heathrow,,0:02:58,,"ask for directions, specific directions",Gets very detailed directions on way to baggage claim from the woman at the terminal coming off the plane at Heathrow,
3/3/2021 11:19:47,kringlan@ucsc.edu,https://youtu.be/B1sWtT-wShI,Realizing the Camera Person is Making People Act Different,https://drive.google.com/open?id=1YC4WcRIzckTXeuTZXnbMvLH3spNr2whj,0:03:29,,"acknowledges camera, assistant, ableism",Talking about how people are acting different because they see the camera person. Saying otherwise probably would not have given choice to walk along to baggage etc,
3/3/2021 11:21:23,kringlan@ucsc.edu,https://youtu.be/B1sWtT-wShI,Giving Bad Directions to Baggage Claim,,0:04:12,,"ask for directions, specific directions",Guy seems confused and gives bad directions (the baggage claim is literally in front of him),
3/3/2021 11:23:22,kringlan@ucsc.edu,https://youtu.be/B1sWtT-wShI,Discloses Disability,https://drive.google.com/open?id=1JqJltcT_jgHQpS8MktsicIQVq0Zpx98B,0:04:21,0:04:22,disability disclosure,"States ""I'm blind""",
3/3/2021 11:26:35,kringlan@ucsc.edu,https://youtu.be/B1sWtT-wShI,Commenting on Forced Assistance,https://drive.google.com/open?id=1PepPLzJjOudOZbfL-TVocV94APewJKZX,0:05:26,,"assistant, ableism, policy","Saying that's the fastest she's gotten through the airport because she didn't have a bunch of people ""helping"" her",
3/3/2021 11:29:39,kringlan@ucsc.edu,https://youtu.be/B1sWtT-wShI,Asking for directions in crowded metro,,0:05:37,,"ask for directions, passerby, ableism","Lots of people just ignoring her while she's asking for directions - I don't know what the right keyword for this is, ableism, I guess? [like fear of a crazy person? indifference? they probably maybe don't realize she's blind??]",
3/3/2021 11:41:36,kringlan@ucsc.edu,https://youtu.be/B1sWtT-wShI,Wondering about People Ignoring Her,https://drive.google.com/open?id=1Wq5HLu6mFmEEIHc0TG21kvtS656K0qkM,0:06:13,,"disability culture, ableism, ask for directions","Wondering why people ignored her requests for directions, wondering if people just aren't used to being stopped in metro by a blind person",
3/3/2021 11:43:04,kringlan@ucsc.edu,https://youtu.be/B1sWtT-wShI,Asking for Metro Directions in front of Metro,,0:06:23,,ask for directions,"Asks for directions to metro in front of metro ticket line, woman says she's not local and doesn't know where metro is (??)",
3/3/2021 11:44:54,kringlan@ucsc.edu,https://youtu.be/B1sWtT-wShI,Discloses ID again when asking for directions to metro,https://drive.google.com/open?id=1V0Ey54uwoJgqAc-ODUmVNOpeH-U3Ogns,0:06:33,,disability disclosure,Woman says she realizes and apologizes after Mona discloses that she's blind,
3/3/2021 11:48:42,kringlan@ucsc.edu,https://youtu.be/B1sWtT-wShI,How are you going to manage,https://drive.google.com/open?id=1LCllpGIpM6MMfThAcocG14IRnqOdgash,0:07:03,,ableism,"Asking for help buying tickets, Metro Assistant asks ""How are you going to manage?"" [getting to Liverpool St, not in buying tickets]",
3/3/2021 12:11:38,kringlan@ucsc.edu,https://youtu.be/B1sWtT-wShI,Explaining How She's Going to Manage,https://drive.google.com/open?id=1YpTRbHkmv_mfXgR5Ss-9Lfj0IbTltA8U,0:07:12,,"ableism, past experiences, disability disclosure",She's explaining she's going to manage the same way she managed to get all the way to the metro- by asking for help and doing things herself.,
3/3/2021 12:13:55,kringlan@ucsc.edu,https://youtu.be/B1sWtT-wShI,Asking how blind she is,"https://drive.google.com/open?id=1Kws65DqF0LkDpmAWLiJJhr5THZ4l4uJs, https://drive.google.com/open?id=1Y26LL0odBIQAqDTyEE3ccLg_Cd_W3pYa",0:07:22,,"ableism, disability disclosure","Asking if she's partially sighted or fully blind, she has to disclose she has light perception, but she says she'll figure [out the way to/through the metro]",
3/3/2021 12:16:48,kringlan@ucsc.edu,https://youtu.be/B1sWtT-wShI,Asking to have choice of assistance or not - metro,https://drive.google.com/open?id=1ZhF6oDaX644cuJbQnSJs8jdp60T3xyBf,0:07:55,,"ableism, assistant, ask for directions, disability disclosure, policy, unclear rules","This whole exchange. Claiming there is a policy requiring she be escorted, she's asking for the choice of assistance or not, metro guy keeps falling back on policy and rules to hide the ableism",
3/3/2021 12:19:30,kringlan@ucsc.edu,https://youtu.be/B1sWtT-wShI,Explaining VIP/MIP,https://drive.google.com/open?id=1u2u8tFiWGmi1HM7Kx-xPj0Q3XwpyT9Jk,0:08:25,,"ableism, unclear rules, policy","Explaining to the blind person what a VIP/MIP is (visually impaired person, mobility impaired person) and that if they are on the train then the train can't be redirected (??) [this feels weirdly like the rationale for not giving them a safety demo on the plane]",
3/3/2021 12:36:04,kringlan@ucsc.edu,https://youtu.be/B1sWtT-wShI,Giving Credentials,https://drive.google.com/open?id=1qTqZAAnl5Ipjxyo0mZkf1dNz5UxVEDa7,0:08:50,,"autonomy, expertise, past experiences, disability disclosure, ableism, value","She gives all her credentials as a professor, someone who has traveled a lot, calls herself ""intelligent"", she says ""I think I can decide for myself if I need the help""",
3/3/2021 12:41:30,kringlan@ucsc.edu,https://youtu.be/B1sWtT-wShI,Realizes their policy is to let her Choose,https://drive.google.com/open?id=1s01Fez2TpeJZs5K0l7IqCbjQBFRb9s1t,0:11:50,,"autonomy, policy, unclear rules, assistant, ableism",Ray looked up the metro rules and realized she can refuse assistance,
3/3/2021 12:43:32,kringlan@ucsc.edu,https://youtu.be/B1sWtT-wShI,"""Cultural Default""",https://drive.google.com/open?id=14mo51c3HNSHWVa99caRrYD0sKws3tMXC,0:12:25,,"disability culture, ableism, policy, unclear rules, autonomy","She's saying it seems like the ""cultural default"" to force disabled people to accept assistance, whereas the actual policy does allow them the choice of whether to take help or not",
3/3/2021 12:45:46,kringlan@ucsc.edu,https://youtu.be/B1sWtT-wShI,Comparing to past travel,https://drive.google.com/open?id=1UzxoXrKchUea9xg0j69Mfl4LsHPvBIFx,0:12:33,,"past experiences, compare experiences, disability culture, policy",She's saying that this whole blow up over policy vs autonomy vs people's ableist expectations happened the last time she traveled as well,
3/3/2021 12:47:58,kringlan@ucsc.edu,https://youtu.be/B1sWtT-wShI,Comparing Trains London and Boston,https://drive.google.com/open?id=1n79s8_Cp2-JyCJ-kmF6Gg_ugD9pqBtRv,0:12:48,,"compare experiences, past experiences, accessibility, ","She's saying that in Boston they don't announce the stops so late, in London they are announcing the stops AFTER they've already arrived at the stop",
3/3/2021 12:49:46,kringlan@ucsc.edu,https://youtu.be/B1sWtT-wShI,Accessibility of Train in London,,0:13:15,,accessibility,She has to remember the order of the stops in order to be ready to get off at hers (since they announce so late) and then remember which way to get out of the train (right or left) and then get off the train (big step) with all her luggage,
3/3/2021 12:52:05,kringlan@ucsc.edu,https://youtu.be/B1sWtT-wShI,Mind the Gap!,https://drive.google.com/open?id=1h9CcPHqhBNven7vV3vZU23XVwiUP6Gl4,0:13:25,,"cultural reference, humor, accessibility",The cultural reference to Mind the Gap! plus she just struggled to get her luggage off the train because of said gap,
3/3/2021 12:53:49,kringlan@ucsc.edu,https://youtu.be/B1sWtT-wShI,No escalators or elevators,https://drive.google.com/open?id=1dsBMI33mjdkvtFpZWpABmG_RzgUgmCq6,0:13:30,,accessibility,They didn't want her to transfer at this station because there are no escalators or elevators - so a completely inaccessible station,
3/3/2021 12:57:58,kringlan@ucsc.edu,https://youtu.be/B1sWtT-wShI,Helping Mona Down the Stairs,,0:13:35,,"ableism, assistant, accessibility","A woman volunteered, unasked, to help Mona down the stairs and carries her luggage for her - like overhelping? And she says she doesn't mind missing her train for this good deed",
3/3/2021 12:59:43,kringlan@ucsc.edu,https://youtu.be/B1sWtT-wShI,Siri Uh-Oh,,0:15:53,,accessibility,Siri keeps losing signal while trying to give directions to the hotel,
3/4/2021 9:58:26,jduval@ucsc.edu,https://www.youtube.com/watch?v=B1sWtT-wShI&list=PL7-KcWQGzCOvbNg2bszlRSAfDa6o_4ziJ&index=3,Luggage Pickup Assistance,https://drive.google.com/open?id=1jEkRuXKG2-o7jmJyCGoizyayiQY-BDMU,0:04:54,,"Asstance, Luggage, Visual Reference","The man lead her by the hand to the carousel and found her luggage for her based on it matching her carry on. Without matching luggage, would she need to carry a picture?",
