Timestamp,Email Address,Media Source URL,1-8 word Summary,(Annotated) Screenshot,Start Time,End Time,Keywords (comma separated),Comments,Meta Level Comment?
3/4/2021 10:00:36,jduval@ucsc.edu,https://www.youtube.com/watch?v=B1sWtT-wShI&list=PL7-KcWQGzCOvbNg2bszlRSAfDa6o_4ziJ&index=3,Locating Metro,https://drive.google.com/open?id=1zWz_MP7B2n6xDLJHtp_497khLAGy-x-h,0:05:36,,"Navigation, Frustration","""They just keep passing you to the next person""",
3/4/2021 10:02:32,jduval@ucsc.edu,https://www.youtube.com/watch?v=B1sWtT-wShI&list=PL7-KcWQGzCOvbNg2bszlRSAfDa6o_4ziJ&index=3,6 People Ignored,https://drive.google.com/open?id=1BavVU0GU-S5eeudGxGuMY-hK9AVqCUen,0:05:44,,Ignored,6 people ignored her when she was politely asking for help...,
3/4/2021 10:04:36,jduval@ucsc.edu,https://www.youtube.com/watch?v=B1sWtT-wShI&list=PL7-KcWQGzCOvbNg2bszlRSAfDa6o_4ziJ&index=3,London Culture,https://drive.google.com/open?id=1svusvhgnf7lArmVmV5oC8zP8iOJT-5AN,0:06:17,,Culture,Mona made a comment about the cultural differences between helping a blind stranger,
3/4/2021 10:09:26,jduval@ucsc.edu,https://www.youtube.com/watch?v=B1sWtT-wShI&list=PL7-KcWQGzCOvbNg2bszlRSAfDa6o_4ziJ&index=3,Ticket buying ableism,https://drive.google.com/open?id=1jelJqWc__PMIxs-mO8SAtnOB8X2MFxQm,0:07:07,,Ableism ,The employee that Mona goes to for assistance with ticket buying asks how she's going to manage public transportation—assuming she can't do it. She just flew across the world and he doesn't believe she can do it. Is adamant that it is too difficult for her and makes her wait for his collegue.,
3/4/2021 10:20:58,jduval@ucsc.edu,https://www.youtube.com/watch?v=B1sWtT-wShI&list=PL7-KcWQGzCOvbNg2bszlRSAfDa6o_4ziJ&index=3,Forced assistance,https://drive.google.com/open?id=1fTxOajgBjYyPQATOi59hIg6WO1L3-wwK,0:07:52,,"Forced, Ableism","Based on their own assumptions they stop Mona and try to force her to have an escort.She asks for a choice and he responds with you haven't git that choice. Train can't be redirected is the excuse... ""She can't be treated like everyone else"". Somehow it is his risk to take. He is so stubborn. Uses the disability act as forced ""policy"". ""This policy is patronizing because you are taking away my choice.She gave him so much calmness and patience. He says he understands but is mansplaining really...She asked his name and shook his hand.",
3/4/2021 10:23:50,jduval@ucsc.edu,https://www.youtube.com/watch?v=B1sWtT-wShI&list=PL7-KcWQGzCOvbNg2bszlRSAfDa6o_4ziJ&index=3,Incorrect Policy,https://drive.google.com/open?id=1Alke_1kjWKzr_jYgciGJaG9MHE15VLbh,0:11:50,,"Forced Assistance, Ableism","He totally made up that ""policy"" and corrects himself over the radio afterwards. ",
3/4/2021 10:26:23,jduval@ucsc.edu,https://www.youtube.com/watch?v=B1sWtT-wShI&list=PL7-KcWQGzCOvbNg2bszlRSAfDa6o_4ziJ&index=3,Cultural Default,https://drive.google.com/open?id=1l3RtFC6q9Qgy9uY5OIZ7v08C1zOKdGE0,0:12:25,,Blind Perspective,Mona reflects on the cultural differences. It is common in London for Mona to refuse assistance and be met with resistance. ,
3/4/2021 10:27:50,jduval@ucsc.edu,https://www.youtube.com/watch?v=B1sWtT-wShI&list=PL7-KcWQGzCOvbNg2bszlRSAfDa6o_4ziJ&index=3,Announce Stop after doors open,,0:12:57,,Infrastructure,London's public transportation gives Mona less time to respond because the stop is announced after the doors open.,
3/4/2021 10:31:06,jduval@ucsc.edu,https://www.youtube.com/watch?v=B1sWtT-wShI&list=PL7-KcWQGzCOvbNg2bszlRSAfDa6o_4ziJ&index=3,No escalators or elevators,,0:13:36,,Infrastructure,No escalators or elevators. Nice people offered to help her with her bags.,
3/4/2021 10:32:28,jduval@ucsc.edu,https://www.youtube.com/watch?v=B1sWtT-wShI&list=PL7-KcWQGzCOvbNg2bszlRSAfDa6o_4ziJ&index=3,Directed with hands,https://drive.google.com/open?id=17C-J5tYNGPhUoAYjUhV8MnXvgBU9BwVC,0:14:31,,"Sighted habits, Navigation",Man gave her directions and gestured with his hands. I wonder if he didn't realize if she was blind or just used hands out of habit. ,
3/4/2021 10:34:39,jduval@ucsc.edu,https://www.youtube.com/watch?v=B1sWtT-wShI&list=PL7-KcWQGzCOvbNg2bszlRSAfDa6o_4ziJ&index=3,Rushed man pushes Mona aside,https://drive.google.com/open?id=1ehho40OwaJg7B7JisIIJXo_IAQD2T-RN,0:14:48,,Culture,Man was in a hurry and pushed her to the side to pass her on the escalator,
3/4/2021 10:37:56,jduval@ucsc.edu,https://www.youtube.com/watch?v=B1sWtT-wShI&list=PL7-KcWQGzCOvbNg2bszlRSAfDa6o_4ziJ&index=3,Uh Oh Siri,https://drive.google.com/open?id=1zqjp5oVeG5aTuqU_phJ9HtX_Fjzf1IPe,0:15:55,,"Siri, Navigation","Siri says ""uh oh lost connection"" multiple times...",
3/4/2021 10:39:23,jduval@ucsc.edu,https://www.youtube.com/watch?v=B1sWtT-wShI&list=PL7-KcWQGzCOvbNg2bszlRSAfDa6o_4ziJ&index=3,Phone Navigation cheers,,0:16:39,,"Navigation, Assistive Tech, Sound Effects, Video Polish",Added a cheers sound track when Siri finally connected the maps navigation,
3/4/2021 10:43:22,jduval@ucsc.edu,https://www.youtube.com/watch?v=B1sWtT-wShI&list=PL7-KcWQGzCOvbNg2bszlRSAfDa6o_4ziJ&index=3,Chocolate Cake,,0:17:12,,Cake,Thoughtful and yummy looking cake with personalizations. Why did the hotel give her a cake? ,
3/4/2021 10:44:00,jduval@ucsc.edu,https://www.youtube.com/watch?v=B1sWtT-wShI&list=PL7-KcWQGzCOvbNg2bszlRSAfDa6o_4ziJ&index=3,Next episode teaser,,0:17:55,,Video Polish,High quality video teasing next video.,
3/4/2021 14:38:24,jduval@ucsc.edu,test,test,,,,Test,Test,
3/17/2021 20:01:42,raferrei@ucsc.edu,https://www.youtube.com/watch?v=HdEd0A8Rmyw,good public transportation,,0:00:05,,"public transportation, train",Subject is smiling and seems happy. This public transportation seems to accommodate him really well and make the getting on/off step an easy process.,
3/17/2021 20:03:26,raferrei@ucsc.edu,https://www.youtube.com/watch?v=HdEd0A8Rmyw,easy bus ride but difficult getting off,,0:00:55,,"public transportation, bus","Shanne is happily surprised about how easy it was to get on the bus with his wheelchair and how spacious it is. However, Hannah shared that getting off the bus was a little hectic without going into details.",
3/17/2021 20:06:39,raferrei@ucsc.edu,https://www.youtube.com/watch?v=HdEd0A8Rmyw,hotel accessibility,,0:01:36,,"hotel, ramp","They reserved a hotel that is not fully accessible, which I would expect to be hard to find in the heart of Paris considering that Paris is a older city. However, the hotel promised to set up a ramp so he could easily get in the building by the time of his arrival.",
3/17/2021 20:07:47,raferrei@ucsc.edu,https://www.youtube.com/watch?v=HdEd0A8Rmyw,public accessibility for tourist,,0:02:16,,"public, ramp",They recorded Shane independently going up a ramp in a public area of Paris,
3/17/2021 20:08:57,raferrei@ucsc.edu,https://www.youtube.com/watch?v=HdEd0A8Rmyw,retail accessabiliity,,0:03:16,,"retail, doors",They recorded Shane easily getting into a retail store by himself since it did not have stairs and the doors were open and wide enough for him to go in without help.,
3/17/2021 20:14:26,raferrei@ucsc.edu,https://www.youtube.com/watch?v=HdEd0A8Rmyw,cobblestone street,,0:03:19,,"street, cobblestones, wheelchair",Shane made fun of a part of the floor that was made of metal and with bumpy texture but did not sound very please with the long street ahead of him which was all cobblestones and slightly uneven.,
3/17/2021 20:15:37,raferrei@ucsc.edu,https://www.youtube.com/watch?v=HdEd0A8Rmyw,accessibility for tourist,,0:03:21,,"boat, wheelchair",Shane was able to get on a turist boat and seemed to be comfortable.,
3/17/2021 21:50:26,raferrei@ucsc.edu,https://www.youtube.com/watch?v=HdEd0A8Rmyw,blocked accessibility,,0:03:56,,"ramp, blocked, inaccessible, public, bus, wheelchair","A tour bus parked on top of the accessiblity ramp blocking it. Luckly, Shane partner saw that there was a big enough gap in between buses for him to go around and access the ramp. His annoyed mom jokingly said she should have keyed the bus while she had to scort him around it.",
3/17/2021 21:51:29,raferrei@ucsc.edu,https://www.youtube.com/watch?v=HdEd0A8Rmyw,accessibility at restaurant,,0:04:19,,"restaurant, wheelchair",They found a spacious restaurant for him to dine in.,
3/17/2021 21:57:40,raferrei@ucsc.edu,https://www.youtube.com/watch?v=HdEd0A8Rmyw,Eiffel Tower accessibility entrance,,0:05:16,,"access, priority, Eiffel Tower, elevator, space, tourist, wheelchair","They  crew at the Eiffel Tower took them through a separate line for those who previously purchased tickets and for ""access"", which seems for those with disabilities. They were able to skip an extensive line. The crew also over-calculated the spece Shane needed to  stay in line and squeezed people to make space for him unnecessarily. This seemed to be one of the few times when Shane seemed actually bothered by people's attitude towards his disability. At the elevator, the crew did not care about space and crammed.",
3/17/2021 21:58:29,raferrei@ucsc.edu,https://www.youtube.com/watch?v=HdEd0A8Rmyw,Eiffel Tower accessibility exit,,0:06:40,,"exit, priority, elevator, wheelchair",The Eiffel Tower crew took them to a priority exit line that allowed them to skip the line to go down the Eiffel Tower. People seemed unbothered and everything seemed to flow very smoothly.,
3/17/2021 21:59:12,raferrei@ucsc.edu,https://www.youtube.com/watch?v=HdEd0A8Rmyw,Street food accessibility,,0:06:57,,"street, wheelchair, food",Shane once again is able to move around by himself on the sidewalk  and have a meal at the table without any problems.,
3/17/2021 22:02:19,raferrei@ucsc.edu,https://www.youtube.com/watch?v=HdEd0A8Rmyw,Getting to cathedral challenges,,0:07:31,,"Street, stairs, obstacle, wheelchair","Even though they show Shane conducting himself through the sidewalk, they were having trouble find their way to a cathedral without coming across a giant flight of steps. It shows very quickly but it seems that they only they found to the cathedral was across another cobblestone street and it seems that someone was holding his wheelchair and supporting his head as he mentioned ""bumpy!"" while driving his wheelchair on the street. Apparently this was the most challenging part of their trip due to lack of having access to better directions and/or options.",
3/17/2021 22:04:23,raferrei@ucsc.edu,https://www.youtube.com/watch?v=HdEd0A8Rmyw,Cathedral accessibility,,0:07:53,,"cathedral, access, wheelchair",They were giving a sepate entrance to the cathedral which lead them to an elevator and no lines appearently. They did not record in the cathedral but mentioned it was accessible. Once again they mentioned that they did not know actually what was happening when people were directed them to a different entrance. It could be for lack of communication or language barrier.,
3/18/2021 14:54:18,bbaltaxe@ucsc.edu,https://overland.org.au/previous-issues/issue-239/feature-on-hospitals/,Frantz fanon tied in,,,,"historical context, philosophy, control","""Frantz Fanon spent much of his life in hospitals, as a worker, writer, and patient. Much of Fanon’s work examined hospitals as institutions of social control, medicalising criminality, and exercising colonial powers."" 

Starting the document out with a famous black philosopher / physician / psychologist and influence on critical theory is a strong start - makes me think this is going to be kind of an intense read. I didn't know who Frantz Fanon was initially so had to look up his history. He argues that the ""creation of specific mental “pathologies” and “disorders”"" are a result of colonialism. 

I suspect ""control"" is going to be a big part of this read. Colonialism = control of countries. Mental health labeling and hospitalization result in social control. ""Medicalizing criminality,"" just another venue to control and maintain marginalized  populations",
3/18/2021 14:59:32,bbaltaxe@ucsc.edu,https://overland.org.au/previous-issues/issue-239/feature-on-hospitals/,The label 'sick',,,,"sick, label, diagnosis","creating the social conditions that enabled the diagnosis of psychiatric disorders, and in turn, the need for institutions capable of housing and controlling the ‘sick’.

just interesting that sick is in quotes. makes you stop and note that ""diagnosis"" results in a label that sort of dehumanizes folks to the point that they can be thought of and controlled as a group. ",
3/18/2021 15:03:39,bbaltaxe@ucsc.edu,https://overland.org.au/previous-issues/issue-239/feature-on-hospitals/,hospitals as government institutions,,,,institutions,"""It’s useful to recall Foucault’s famous formulation, asking whether it is surprising that prisons resemble factories, schools, barracks, hospitals, which all resemble prisons. ""

Another famous philosopher name drop early in the post.. I don't know much about Foucault. Definitely interesting that they are specifically positioning hospitals with institutions like factories, barracks and prisons so early on in the piece. Feels government mandated and large somehow, even though I generally think of hospital care more on the individual level. I guess we will be talking about hospitals as institutions? ",
3/18/2021 15:07:18,bbaltaxe@ucsc.edu,https://overland.org.au/previous-issues/issue-239/feature-on-hospitals/,Hospital as warfront ,,,,"Politics, govenment, war, military","""As hospitals and aged care living centres become the frontlines in the struggle against COVID-19, now more than ever we must confront and interrogate the role these institutions play in our lives, and how we must reshape them towards the social good we need in our communities.""

Continuing the illustration of hospitals as military here with ""frontlines."" Compared earlier hospitals to barracks and government. Highly political framing. 

I wonder what the social good proposed is? It's a hook! ",
3/18/2021 17:01:16,raferrei@ucsc.edu,https://www.youtube.com/watch?v=HdEd0A8Rmyw,Public restroom accessibility,,0:08:20,,"restroom, public, wheelchair","They show Shane coming out of a public restroom by himself, which was accessible and spacious enough for him and his companion. He seemed very content.",
3/18/2021 21:37:44,elgkim@ucsc.edu,https://vm.tiktok.com/ZMeS4v2k9/,explaining missed quiz because of disbility,,0:00:06,,"neurodivergent, rant, college, education, word choice","When they start to explain that they missed their quiz due to their disability, they say ""disability"" instead of the the specific name of the disability. Looking further into their account, they wrote ""neurodivergent"" in their biography, showing that they are open and comfortable with disability to the public. Before looking into their account, I thought maybe they were not comfortable with sharing information, but now I believe that this word choice may have been due to the long name or that they were trying to fit the rant into the short video.",
3/18/2021 21:46:33,elgkim@ucsc.edu,https://vm.tiktok.com/ZMeS4v2k9/,professor says it's not too late to drop,,0:00:09,,"neurodivergent, ableism, rant, college, education, anger, professor","They show anger at the professor's response. The professor's response is condescending, especially as his first response implies that they won't make it far in the class. To this professor, this one mistake supports his idea of how this creator will do in his class. ",
3/18/2021 21:55:15,elgkim@ucsc.edu,https://vm.tiktok.com/ZMeS4v2k9/,states the class and their grade,,,0:00:12,"neurodivergent, rant, college, education, word choice","Creator states what class and that they are graduating this year. They say this in a short sentence with a hard tone. I think this shows a level of anger and frustration as they were being put down in when they are more than capable in this class and that they just made one mistake. This is an unfair situation that can happen to anyone, and I'm not sure if the professor even knew that they missed the quiz because their disability was acting up.",
3/18/2021 22:02:37,elgkim@ucsc.edu,https://vm.tiktok.com/ZMeS4v2k9/,creator is treated like a child,,0:00:17,,"neurodivergent, rant, college, education, professor, word choice ","The professor responses and belittles the creator whenever they make a make a mistake or a question. The creator also relates this situation to being treated a like a child. Do they make this comparison because they feel like they are smaller or helpless? There are other ways to describe being condescended or put down, and them deciding 
to compare to how a child is treated by an adult is interesting. ",
3/18/2021 22:08:30,elgkim@ucsc.edu,https://vm.tiktok.com/ZMeS4v2k9/,creator reaches out to school's facebook,,0:00:23,,"neurodivergent, rant, college, facebook group","Creator reaches out to people in the school's facebook group to see if anyone else has a similar experience with this professor. Not many people do, which kind of surprised me but also didn't. I was surprised because I had expected there to be some people with this kind of experience, but then I also don't really know the statistics of how many people with disability are in that school/class. And I was not surprised because not all disabled people would've taken that class and also because there might some people who are ashamed/embarrassed to share their story. ",
3/18/2021 22:14:52,elgkim@ucsc.edu,https://vm.tiktok.com/ZMeS4v2k9/,another student with similar experience,,0:00:30,,"neurodivergent, rant, college, similar experience, ableism","Another female disabled student states that she had a similar experience, where the professor was rude to her and only her. The fact this professor treated only this student in this manner seems to support that the professor has ableist sentiments",
3/18/2021 22:19:32,elgkim@ucsc.edu,https://vm.tiktok.com/ZMeS4v2k9/,to let go or to report,,0:00:38,,"neurodivergent, rant, college, report","Creator debates on whether or not to report to the head of department and office of disabilities. Personally, I think that I would support them reporting, but at the same time, it seems like they were able to get only that one female disabled student's experience. This might not be enough experiences of students to effectively complain about this professor. ",
3/18/2021 22:23:34,elgkim@ucsc.edu,https://vm.tiktok.com/ZMeS4v2k9/,sick and tired of these experiences,,,0:00:44,"neurodivergent, rant, tired, tone","Saying that they are sick and tired, showing that this isn't the first time they had gone through this. Their voice sound strained as they say this and I could feel their anger as they emphasize ""sick"" and ""tired"". They shouldn't have to experience this in an academic setting and be treated fairly. ",
3/18/2021 22:26:58,elgkim@ucsc.edu,https://vm.tiktok.com/ZMeS4v2k9/,misogynistic and ableist professors ,,0:00:46,,"neurodivergent, rant, college, misogynistic, ableism","For the first time, they mention misogynism. Not surprised, as misogynism still unfortunately common today. But they probably mention this as the other student was female and because of prior experiences. ",
3/18/2021 22:30:51,elgkim@ucsc.edu,https://vm.tiktok.com/ZMeS4v2k9/,getting away with it,,0:00:47,,"getting away, ableism, professors, misogynism","It angers me to see that professors are getting away with this unfair treatment, especially in a setting where all students should be supported throughout their academic career. How hard can it be to refrain from saying those comments or giving out fair grades?",
3/18/2021 22:34:41,elgkim@ucsc.edu,https://vm.tiktok.com/ZMeS4v2k9/,mentions misogynistic but then does not later,,0:00:50,,word choice,"Creator mention misogynistic and ableist professor, but then also not mentions misogynism in her later sentences. I wonder why she chooses to only mention misogynism for a short period of time. Is it because of the time crunch on their video or did they think that the ableism plays a bigger part in this situation? ",
3/18/2021 22:38:22,elgkim@ucsc.edu,https://vm.tiktok.com/ZMeS4v2k9/,treating disabled students like they're unintelligent,,0:00:48,,"ableism, college, education, professors, stereotypes",Stereotypes about people with disabilities being unintelligent seems to play a big part of in this situation. If only there was a way to break this stereotype for good.,
3/18/2021 22:40:46,elgkim@ucsc.edu,https://vm.tiktok.com/ZMeS4v2k9/,office of disabilities ,,0:00:41,,"office of disabilities, ironic","It seems ironic that this school has an Office of Disabilities, and yet this professor still acts this way, which points to the fact that the office has not yet action for this professor's behavior. Has no student or other staff reported the professor? I wonder why.",
3/18/2021 22:42:50,elgkim@ucsc.edu,https://vm.tiktok.com/ZMeS4v2k9/,Music Choice,,0:00:00,0:00:50,music choice,"Despite the angry nature and tone of the creator and the content, the music is bright and happy. It seems to make this video and its topic to be perceived as lighter and more approachable? The creator might have made this choice to balance the anger and the heaviness of the topic of ableism.",
3/19/2021 11:11:16,raferrei@ucsc.edu,https://www.youtube.com/watch?v=HdEd0A8Rmyw,Recording and editing choices,,,,"editing, recording, perspective, wheelchair, camera","The recording is done by Hannah since apparently Shane would not be able to hold a conventional camera due to the nature of his disability. She is mostly recording Shane, his reactions, and showing him going through accessible places but from her perspective. There isn't heavy or complex editing but there are parts with just images and music, there is a video intro, and close caption.",Yes
3/19/2021 11:59:51,raferrei@ucsc.edu,https://www.youtube.com/watch?v=HdEd0A8Rmyw,Choice of close caption,,,,"close caption, editing, speech impairment","Shane’s speech is lightly impaired and I noticed that different videos that they recorded in a quiet place do not have close caption. However, the one recorded outside while visiting Paris had close caption for everyone. Which I think is safe to say that it was a choice based on the environment not on Shane's disability.",Yes
3/19/2021 12:02:45,raferrei@ucsc.edu,https://www.youtube.com/watch?v=HdEd0A8Rmyw,Tourist attractions preparedness and communication,,,,"crew, tourist, wheelchair, communication, accessible","Both times when they were taken by tourist attraction crew to a special queue or a more accessible path, Shane and Hannah were not sure of what was precisely happening or what the new steps would be. It could be a language barrier or lack of communication from the crew.",Yes
3/19/2021 12:34:25,raferrei@ucsc.edu,https://www.tiktok.com/@sky__0_o/video/6935731764463684869?lang=en&is_copy_url=0&is_from_webapp=v2&sender_device=pc&sender_web_id=6873965249407845894,A mute person sharing their glow up,,,,"mute, trending, hashtag, music, audio, ASL",A mute person sharing their version of a very popular trend on TikTok where people share pictures of their glow up. Those videos are usually linked to specific music but this creator has a video with no music and some environmental noises that are barely noticeable. This shows no audio editing and most importantly no linking his video to the musics that would also work as tag and could expand his visibility. The use of hashtags in the video description is very limited and not similar to most videos doing the same trend which is unclear if it is for lack of understanding or choice. They used written words in the video like it is commonly done for this trend and did not use ASL.,Yes
3/23/2021 19:05:07,elgkim@ucsc.edu,https://youtu.be/M-QcdHgJQwc,introducing vlog content ,,0:00:00,0:00:18,"vlog, tourettes, introduction","simple introduction of what the vlog is going to be about, cute and energetic. Will be making brownies. said will be doing ""make my treats disappear"" challenge if the video reaches 1000 likes. Seeing other videos by other people with Tourette, I would guess that maybe she's implying that she will throw the dessert? But it's just a guess and I will have to see later.",
3/23/2021 19:22:31,elgkim@ucsc.edu,https://youtu.be/M-QcdHgJQwc,tic attack,,0:00:19,0:00:24,"Tourette, vlog, tic, tic attack, video editing","The creator shows a series of tics, and uses a black screen to say that she was having a tic attack. The style of editing and the black screen seemed to make the situation less heavy and bring a comedic effect, especially with the comic sans font which used to be ( and still is?) a form of joke. This style of editing is often used in other vlogs as well. I think this matches well with the age of the creator (she seems pretty young) and goes to show the intended atmosphere of the video. It seems that the creator intended to create a light-hearted video about her experience with cooking with Tourettes.",
3/23/2021 19:30:37,elgkim@ucsc.edu,https://youtu.be/M-QcdHgJQwc,Vlog intro part 2,,0:00:25,0:00:48,"vlog, video editing, tics, tourette","The creator introduces the content of the video again. There are tics in between the dialogue and there are quite a bit of cuts in between the scenes. However, they were all very subtle and smooth, which might be difficult to do tics. The creator's parents or a family member seems to be present in the room and/or filming, which makes me wonder if the family also assists in the editing process.",
3/23/2021 19:41:52,elgkim@ucsc.edu,https://youtu.be/M-QcdHgJQwc,pouring flour,,0:01:05,,"vlog, baking, prep, Tourette, tic",creator holds her wrist as she pours the flour to prevent an accident caused by her tic. both the creator and I are nervous about the events to come.,
