Timestamp,Email Address,Media Source URL,1-8 word Summary,(Annotated) Screenshot,Start Time,End Time,Keywords (comma separated),Comments,Meta Level Comment?
4/7/2021 15:59:03,raferrei@ucsc.edu,https://disabilityvisibilityproject.com/2021/03/10/my-year-of-nothing-but-everything/,Meta level summary and personal takes,,,,"wheelchair, COVID, vaccine, ableism, equity, public health, coronavirus","This text is a great insight of how sometimes things are not necessarily what they are portrayed to be. The vaccination roll out has been advertised as an equitable and on paper it is however Emily shows us that systemic ableism does not disappear even when top officials try to implement a fair approach. Her need is easy to understand and quite obvious to see but still she struggled to get her first vaccine. It is worth mentioning that Emily is finishing her PhD program and is probably very resourceful, very comfortable with science, and capable to understand and handle the situation still she struggled to get something she was entitled to. The vaccination eligibility was made equitable but the accessibility to it was not. It is also important to notice that days’ notice vaccination is not something disable people can easily accommodate for. Also, to realize that, when she thought she could have caught COVID, there was no option for her to get tested without risking friends since she had to rely on them to go get tested. This is another example of how our healthcare system is very unprepared to help disable people due to privatization, lack of legislation protecting disable, systematic white supremacy that hinders other groups like she pointed out. Lastly, Emily tried to point out the root cause of the systematic ableism she faced which were the state of Pennsylvania, government in general, or her university. This could indicate how some of those problems could be local and not necessarily nationwide. For example, I personally only know of people in California and New York that knew when they were receiving their vaccination days if not weeks ahead of time. 
Emily’s choice of naming her article “My Year of Nothing but Everything” shows how polarized her year was. Our government, her university, and healthcare system failed her however she found comfort and strength in other marginalized groups. She helped me understand how being in her situation amplifies hardships in unimaginable ways but also how mutual support and community is key for physical and metal survival. Her well written personal letter was split into groups of related parts in a chronological way making it all clear and easy to understand.",Yes
4/7/2021 16:16:58,qyu23@ucsc.edu,https://www.nytimes.com/2020/07/07/style/disability-accessible-beauty-makeup.html,Cosmetology workshops for disabled people,,,,"beauty, makeup, accessibility, workshop, innovation","""Kohl Kreatives, a beauty label out of London, started as a charitable service in late 2015, offering free one-on-one and group cosmetology workshops for individuals with a range of concerns including motor impairments. "" This is heartwarming to see an organization dedicated to helping people with disabilities enjoy makeup with a unique sense of understanding and adaptability that is different from other makeup classes.",
4/7/2021 16:23:49,qyu23@ucsc.edu,https://www.nytimes.com/2020/07/07/style/disability-accessible-beauty-makeup.html,Makeup brushes for motor impaired,,,,"makeup, beauty, accessibility, motor impairment, disabled, innovation","(On makeup brushes) “I created a product that would be acceptable for as many people as possible. I looked into A.L.S., Parkinson’s, multiple sclerosis, lupus, arthritis — lots of different areas with tremors and grips” Trishna Daswaney was incredibly dedicated to developing brushes that almost everyone can use comfortably. She greatly helped motor impaired people enjoy makeup again and promote universal design in an industry that cares little about it.",
4/7/2021 16:35:00,qyu23@ucsc.edu,https://www.nytimes.com/2020/07/07/style/disability-accessible-beauty-makeup.html,Difficulties in makeup for motor impaired,,,,"beauty, makeup, accessibility, motor impairment, struggles","""For Ms. Michele, setting powder typically poses a challenge to open because many are packaged in flat, round containers. As for eye shadows: The brushes are small and hard to hold[...]"" These observations show how minor features in makeup products can cause great difficulty in a disabled person's user experience. Manufacturers need to take more consideration into how useable their products are for different populations.",
4/7/2021 18:31:20,elgkim@ucsc.edu,https://youtu.be/DiFJryy_jiY,creator asks other people about Tourette's,,0:00:15,,"tourettes, reaction, educating","Creator asks if the players know that she has Tourette's and if they know what that is. I think that this was a good question to ask before the games. Aside from the fact that the intention of this question was because her tics can accidentally sabotage her, it also provides a moment of awareness of Tourette's as a disability and also an opportunity to educate others. But in this situation, other people knew what Tourette's were and the opportunity passed. But there was an awkward pause after the question was asked, and the players seemed hesitant to answer to the point where one of the players said ""anyone want to speak up?"". I wonder why they were hesitant to answer. Were they just rethinking about what Tourette's were?",
4/7/2021 18:39:35,elgkim@ucsc.edu,https://youtu.be/DiFJryy_jiY,montages of tics,,0:00:25,0:01:17,"tics, tourettes, editing",Montage of her tics throughout the game. So far there were not any that affected her game play and were mostly verbal.,
4/7/2021 18:40:35,elgkim@ucsc.edu,https://youtu.be/DiFJryy_jiY,killed off,,0:01:18,,gaming,"Oops, got killed off. She does not seem amused.",
4/7/2021 18:46:39,elgkim@ucsc.edu,https://youtu.be/DiFJryy_jiY,thanking her viewer (tic),,0:01:35,,"tics, tourettes, gaming","She thanks her viewer and then says ""what a twat"", but then immediately says that she doesn't mean it. Sometimes her tics can come off as her intentionally saying it because there may not be a change in tone or accent that some of tics usually have. I wonder if there would be a good way to help distinguish between what is intended and what is a tic so that people with Tourette's don't have to worry about saying unintentional things.",
4/7/2021 18:51:20,elgkim@ucsc.edu,https://youtu.be/DiFJryy_jiY,viewer warns about standing up,,0:01:51,,"gaming, reaction, sexualizing","One of her viewer warns her to not stand up anymore. Videos of her clips apparently has a lot of clips that focus on her backside (as she stand up from her chair). Frustrating to hear, this creator just wants to play games and sometimes has to stand up. Because of people sexualizing her, she has to be careful when she performs the simple act of getting up from her chair. ",
4/7/2021 18:52:21,elgkim@ucsc.edu,https://youtu.be/DiFJryy_jiY,given up on deleting clips,,0:02:08,,"gaming, sexualizing",She implies that she already knew about this and says that she has given up deleting the clips..,
4/7/2021 18:54:40,elgkim@ucsc.edu,https://youtu.be/DiFJryy_jiY,mixed reaction about this problem,,0:02:26,,"gaming, sexualizing","Some players were confused, and others say that they get the same problem",
4/7/2021 19:07:07,elgkim@ucsc.edu,https://youtu.be/DiFJryy_jiY,calling customer service,,0:05:21,,"tourettes, tics, reaction","She says that she tried to call customer service but they kept hanging up because she telling them to f*ck off (tics). I think this is a good example of some of the issues that people with Tourette's go through. She didn't exactly explain how the conversation exactly went, but I would like to say that probably explaining that she has Tourette's might have helped with the issue of them hanging up. But that is only the case if the person on the line knew what Tourette's are. Otherwise, she would have to explain and educate them, which would take a bit of time. So I think that if the employee knew what Tourette's are and if the creator mentioned that she has Tourette's, it would have been a manageable situation. I think that this could be an example as to why educating the public is important.",
4/7/2021 19:15:47,elgkim@ucsc.edu,https://youtu.be/DiFJryy_jiY,"close call, almost killed",,0:06:12,,"gaming, tics, tourettes","Creator almost killed player in the presence of a witness. Not sure if not clicking it was a tic, or if she intended to click it and her tic saved her, or if a tic was not even involved.",
4/7/2021 19:18:41,elgkim@ucsc.edu,https://youtu.be/DiFJryy_jiY,curses at her friend (tic),,0:06:55,,"tics, tourettes, reaction","Tells her friend to f*ck off and apologizes, but because the creator informed the other players about her tics, the players were not offended. Shows that communication and education is important in avoiding miscommunication that could arise from tics ",
4/7/2021 19:34:34,elgkim@ucsc.edu,https://youtu.be/DiFJryy_jiY,explaining her tic,,0:07:53,0:08:26,"tics, tourettes, educating, reaction","After one of her tics, a player mentions that she sounds like a gps. To this, she explains echo, which is when a person with Tourettes copies something that they have heard earlier, and repetition affects the tics as well, which may become annoying In Overwatch and the repeating voicelines. She also mentions that the tics can morph. This was new information to me, and it was a qeustion that I was curious about. The players seem to interested as well. Another good opportunity for the players and viewers to learn more about Tourette's.",
4/8/2021 21:31:26,elgkim@ucsc.edu,https://www.tictastic.com/my-story/,blog about personal experience by person with Tourette's,,,,"blog, tourettes, tics, treatment, experience","Wilamena writes about her journey in life with tics, starting from the first sign of Tourette's to her treatment experiences. She gives a very detailed description, including specific dates and ages. I think that this makes the experience seem more personal to the person reading this, as it solidifies the experience through actual numbers. This level of detail of her hardships touches my heart, especially since that this is the first time I've been able to read about the darker side of Tourette's instead of the comedic sides that I've seen go viral. The possible injuries and dangerous situations that she had gone through at such a young age made me realize the reality of this disability. In that sense, I think she did a great job educating the viewers through her personal journey. Additionally, she included more links within this page about her tics, struggles, methods/things that helped her, and general information about what Tourette's are. Her descriptions and explanations are easy to understand as a person who doesn't know much about Tourette's. I think that this very personal account of her life allowed me to empathize with her, even if I will never be able to fully understand. At the very least, I am now knowledgeable of what she and others experience. And it is through her personal experience I can more easily understand the disability itself. I also like how the blog name is ""TicTastic!"" because it creates a positive energy. Although with the trending videos of tics recently, I wonder if this might only support the recent comedic aspects of Tourette's. While the rising awareness could be a good thing, I think that new stereotypes might arise and undermine the struggles of Tourette's. But I think her intention was to create a bright and child-like logo to highlight that the blog is about her experience of growing up and pushing through with Tourette's and OCD. ",
4/9/2021 10:16:18,raferrei@ucsc.edu,https://disabilityvisibilityproject.com/2020/11/29/ep-91-disabled-engineers/,Disable person pursing higher education,,0:00:00,0:17:30,"wheelchair, disable, mobility, education, higher education, disabled scientist, internalized ableism, ableism,  systemic ableism","Emily explains that  she got into chemical engineering when a professor told her that she could be on the computational side of engineering by choosing that area since the physical demands of a lab does not match her physical capabilities no matter the adaptations making it impossible for her to pursue certain engineering areas. Emily mentions the diversity trend in higher education but without the equity side of it. This means that schools are trying to bring minorities to their campuses but once they are there there are little to no support to their specific needs. Which brings up another problem as pointed out by Emily that is internalized ableism. She shares that having to request accommodations or ask professors for some flexibility is a struggle for most disable people but she pointed out how important it is to do it in order to overcome that barrier and succeed in academia. Based on their dialogue, part of the problem is the institutions, staff, and faculty lack of understanding disabilities and how those accommodations do not mean a special treatment or take away from the student's qualification.",
4/9/2021 10:18:15,raferrei@ucsc.edu,https://disabilityvisibilityproject.com/2020/11/29/ep-91-disabled-engineers/,Tech and disability,,0:17:40,0:27:40,"wheelchair, disable, mobility, internalized ableism, ableism,  systemic ableism, tech, inclusive design, robots","After Emily’s traumatic experience with the robot and being in the spot light, she believes that ethical design is an important part of equity specially in tech. Lack of diversity in tech compromises their products since early developmental stages. Emily doesn’t blame abled people for not being fully aware of disable people’s reality but the lack of actions to address that problem is to be blamed in tech. Tech should slow down and make sure that whatever is being created will include disable in their thought process. ",
4/9/2021 10:21:40,raferrei@ucsc.edu,https://disabilityvisibilityproject.com/2020/11/29/ep-91-disabled-engineers/,Ways to address ableism,,0:27:40,0:34:07,"wheelchair, disable, mobility, education, disabled scientist, internalized ableism, ableism,  systemic ableism, tech, representation, inclusive design","After Emily’s traumatic experience with the robot and being in the spot light, she believes that ethical design is an important part of equity specially in tech. Lack of diversity in tech compromises their products since early developmental stages. Emily doesn’t blame abled people for not being fully aware of disable people’s reality but the lack of actions to address that problem is to be blamed in tech. Tech should slow down and make sure that whatever is being created will include disable in their thought process. ",
4/9/2021 10:22:21,raferrei@ucsc.edu,https://disabilityvisibilityproject.com/2020/11/29/ep-91-disabled-engineers/,Ways to address ableism,,0:27:40,0:34:07,"wheelchair, disable, mobility, education, disabled scientist, internalized ableism, ableism,  systemic ableism, tech, representation, inclusive design","After Emily’s traumatic experience with the robot and being in the spot light, she believes that ethical design is an important part of equity specially in tech. Lack of diversity in tech compromises their products since early developmental stages. Emily doesn’t blame abled people for not being fully aware of disable people’s reality but the lack of actions to address that problem is to be blamed in tech. Tech should slow down and make sure that whatever is being created will include disable in their thought process. ",
4/9/2021 10:22:54,raferrei@ucsc.edu,https://disabilityvisibilityproject.com/2020/11/29/ep-91-disabled-engineers/,Tech and disability,,0:17:40,0:27:40,"wheelchair, disable, mobility, internalized ableism, ableism,  systemic ableism, tech, inclusive design, robots",Example of tech not acknowledging disable people. How tech can put disable people in physical and mental harmful situations when disable people are not taken into consideration. Challenges of being in the spot light and receiving either supportive or aggressive messages while disable. Challenges of dealing with dismissive behavior while disable. How disability often is an afterthought in tech.,
4/9/2021 10:24:41,raferrei@ucsc.edu,https://disabilityvisibilityproject.com/2020/11/29/ep-91-disabled-engineers/,Addressing institutional ableism,,0:34:07,0:38:45,"wheelchair, disable, mobility, education, internalized ableism, ableism,  systemic ableism, tech, representation, inclusive design, equity",Ways to address institutions ingrained in ableism. Educational institutions and work places need to keep equity in mind since disabled people often do not have access to the fully range of opportunities that abled people do. Importance of allowing disable people to become role model in our society for better top down choices and to inspire other disables. Slow down the tech creative process when profitability comes at the expense of the marginalized. ,
4/9/2021 10:39:47,bbaltaxe@ucsc.edu,https://www.youtube.com/watch?v=D6fK0Yxm8GQ,Calm intro wake up,https://drive.google.com/open?id=1dvfU877EQI-33QI9Hwb0SsN_gux-H4jB,0:00:05,0:00:45,"bed, calm, clean, quiet, care, anxiety, audio, routine","The opening of this video is so calm. There's no music, just the audio of the room with birds outside the window. This quiet start is a stark contrast to anxiety. With a million thoughts flying around in your head it can be difficult to be in quiet spaces like this. I think this is a really nice start. 

You can tell that the bed was made before she got in it. She then gets up and makes it before starting her day. Her laptop is in the bed so it feels lived in, not totally perfect. I think little routines like this are really important for mental health, but they're not easy (for me at least) to keep. 

This little routine sets the scene for the rest of the video.  ",
4/9/2021 11:02:02,elgkim@ucsc.edu,https://www.tictastic.com/my-story/,media coverage ,,,,"tourettes, media, reaction",Seeing a new and darker side of her experience made me realize and remember that not all publicity/media coverages will correctly and fully represent a disability (or anything really). ,Yes
4/9/2021 11:04:21,raferrei@ucsc.edu,https://disabilityvisibilityproject.com/2020/11/29/ep-91-disabled-engineers/,Technical analyses,,,,"podcast, design, polish, editing","The podcast uses audio effects to indicate changes of subject making it easy to follow. The audio quality is good, there is no ambient noise, and the podcast provides a transcript in pdf and google files. I decided to use my headphones while listening since the host sometimes may require more attention to understand which I believe is due to her need to use a respiratory device however I did not need to use the transcript at any moment. Their website uses tags and links with more information about those involved with it making it easy to explore their individual work. There is also “related links” section with links to directly related topics discussed during the podcast. An annotated picture of Emily Ackerman and a short intro. There is a comment section and links to next and previous content which makes navigation fairly easy. It is a simple white background page, with little variance of font type and size throughout the page and a minimalist design.",Yes
4/9/2021 11:06:59,bbaltaxe@ucsc.edu,https://www.youtube.com/watch?v=D6fK0Yxm8GQ,Guided by tech for yoga and meditation,,0:01:10,0:03:17,"yoga, meditation, anxiety, computer mediated","She meditates and does yoga in the mornings. For both, she does guided using a laptop or her phone. For her meditation she explicitly says she uses a phone app, for yoga she doesn't mention it. 

I think this is nice, you don't have to do it on your own or know what to do. I wonder if there could be a guided morning routine app or video. ",
4/9/2021 11:16:38,bbaltaxe@ucsc.edu,https://www.youtube.com/watch?v=D6fK0Yxm8GQ,Make self care an event (jewelry) ,https://drive.google.com/open?id=13manBO5RxPSyzMrb1aqXxw_ohIrA_6H7,0:03:45,0:04:00,"routine, ritual, jewlery, axiety, ","As she's getting ready to do her skin care routine she says: 

""After I take a shower I really like to put my jewelry on [shows off rings and earnings] because. I don't know. It makes body care and skin care more fun, like you feel more elegant, you know what I'm saying? So I put my jewelry on."" 

I think this is super interesting. It kind of makes a routine into a ritual or an event. There's no one to dress up for if you're just about to put lotion on, but there really is something to treasuring yourself and feeling beautiful as you take care of yourself. 

This idea is really present throughout the video. Her nails are done nicely, her apartment is totally spotless and nicely decorate. But it's also posted on June 20, 2020 during a pandemic and it seems like she lives alone. ",
4/9/2021 11:23:27,bbaltaxe@ucsc.edu,https://www.youtube.com/watch?v=D6fK0Yxm8GQ,skin care,,0:07:45,0:09:14,"self care, fun, anxiety","This reads just like a generic makeup routine video, but she's not showing her products which is nice. She seems like she's getting through it but also seems like she's having fun, posing for the camera with lotion on her face. Just seems like not-so-serious business which is nice for self care. It doesn't seem like a chore to her. ",
4/9/2021 11:28:27,bbaltaxe@ucsc.edu,https://www.youtube.com/watch?v=D6fK0Yxm8GQ,"Outfit choice, comfort and style",,0:09:13,0:09:54,"Comfort, Style, Anxiety, self care","She shows off her outfit of the day. A white shirt with loose fitting, stretchy pants. The outfit is new. She says that she chose it to be comfortable and simple. 

She dresses it up with a necklace to feel a little more stylish. 

I love that she is wearing slippers when she is showing it off. It feels like she is trying really hard to be comfortable and care for herself but also look nice. Actually, it seems like for her looking nice is a part of self-care. ",
4/9/2021 11:33:36,bbaltaxe@ucsc.edu,https://www.youtube.com/watch?v=D6fK0Yxm8GQ,Says again jewelry is important ,,0:10:15,0:10:37,"ritual, routine, anxiety, jewelry","""I just want to say again how important wearing jewelry is to me when I'm getting ready. Like. Even the way I hold my [makeup] brush is different. I just did my nails two days ago, and I'm wearing my rings. Like it just - the application feels different. It's a different experience."" 

Just wanted to add in this quote. It seems really important to her to make her self care into an experience. ",
4/9/2021 11:41:12,bbaltaxe@ucsc.edu,https://www.youtube.com/watch?v=D6fK0Yxm8GQ,"Prioritizing self over scrolling, morning energy",,0:11:42,0:12:18,"scrolling, prioritizing self, self-care, anxiety, technology use","""OK, so I don't really like checking my phone first thing in the morning. I like to do all of my self care stuff first before I check emails, open twitter, read the news. Especially with the current state that the world is in, I don't really like using all of my energy that I've woken up with and putting it into that - into consuming information immediately. I like to take care of myself first."" 

It's important for her morning routine to put herself first. I know from my experience with having an anxiety disorder that mornings can be an especially difficult time. It seems smart to put your morning energy into yourself. I wonder what the implications are here of technology use. 

She does use her phone for meditation and yoga in the morning, so it's not like she doesn't look at it all together.

""I like to use apps for things other than social media..."" learning languages etc. It seems like she has some feelings about social media even though she doesn't speak to them directly here. It seems like she views social media as bad for her which is interesting. ",
4/9/2021 11:45:38,bbaltaxe@ucsc.edu,https://www.youtube.com/watch?v=D6fK0Yxm8GQ,Keep self care simple,,0:13:06,0:13:27,"routine, anxiety, self care","""In the past I've done really intense morning routines but I've found that, um, I don't like starting my day with trying to complete so many tasks. Because by the time I finish my morning routine, I'm like mentally exhausted because I've been checking off a checklist just for my morning routine."" 

Implies that checking off tasks from a list can be unhelpful for anxiety. 

Keep care simple. It's hard to keep caring for yourself if it feels like just another task. That's a nice takeaway. I would also add from what I've learning in this video: Keep care simple and celebratory.",
4/9/2021 11:52:16,elgkim@ucsc.edu,https://vm.tiktok.com/ZMeS4v2k9/,reflection,,,,reflection,"The video that I took notes on was a rant that I found on TikTok. The creator was a person with neurodivergence, and they were ranting about an ableistic situation that they were facing in school. As this was my first video and filling out the form, I have yet to find any trends or patterns with other videos. But in this specific video, I learned more about how ableism can be prevalent in academic settings even while most students are not able to recognize it as people without disabilities wouldn’t experience this. And additionally, with remote learning, more interactions between professors and students are more private, which means that other students and staff are less likely to recognize ableism in a classroom setting. For the logging, I found that sending myself my responses helped with reusing tags and the links in the form. While it was awkward to log at first and didn’t know what I should be rewriting, I got more comfortable with the process but I think I’m still not used to writing out my thoughts.",Auto-ethnographic Reflection
