Timestamp,Email Address,Media Source URL,1-8 word Summary,(Annotated) Screenshot,Start Time,End Time,Keywords (comma separated),Comments,Meta Level Comment?
3/23/2021 19:48:38,elgkim@ucsc.edu,https://youtu.be/M-QcdHgJQwc,Pouring the milk,,0:01:29,0:02:04,"vlog, baking, Tourette, milk",The creator is about to pour the milk and is nervous about the process. She stands to think about how to go about pouring the milk and puts her phone on another counter. Everything seems to go smoothly. ,
3/23/2021 19:52:26,elgkim@ucsc.edu,https://youtu.be/M-QcdHgJQwc,repeated phrases,,0:02:30,,"tics, vlog, Tourette,","Seems to repeat the phrases ""F*ck off"" and ""Nick's"" often. And other phrases seem to be vaguely related to the object or the situation",
3/23/2021 20:00:12,elgkim@ucsc.edu,https://youtu.be/M-QcdHgJQwc,breaks the eggs,,0:02:46,,"tics, accident, vlog, baking, Tourette","broke 2 eggs, quite a sudden motion. Surprised me a bit because it was kind of unexpected. The creator shows instead regret for throwing the eggs  and quickly tries to clean up the mess.",
3/23/2021 20:02:15,elgkim@ucsc.edu,https://youtu.be/M-QcdHgJQwc,using the stove,,0:04:34,,"Tourette, vlog, baking, stove",About to use the stove. Getting worried because the stove can be dangerous and prone to accidents,
3/23/2021 20:07:03,elgkim@ucsc.edu,https://youtu.be/M-QcdHgJQwc,Cooking the pancakes,,0:05:38,,"tics, vlog, baking, Tourette","Very nervous whenever the creator reaches for the pan. Seeing how sudden some of the tics can be, I'm worried that she might smack the pan ( like she did earlier). I wonder how they prevent accidents? The person behind the camera is most likely a bit far away to capture the scene, so I don't think that they'd be able to stop the creator in time from hurting herself from a tic. But now in this part of the video, I don't hear anyone else in the room.",
3/23/2021 20:12:16,elgkim@ucsc.edu,https://youtu.be/M-QcdHgJQwc,waiting for the pancake to cook,,0:06:02,0:06:31,"tic, vlog, baking, Tourette, body language","Compared to before and despite my worries, the creator seems less nervous in front of the stove. When making the batter, there were signs of the creator attempting to restrain herself to prevent accidents from her tic, but there are no signs of that now. She's putting her weight on one leg and has a hand on her hip, making herself seem more relaxed. I would think that she would be more nervous in front of the stove because of possibility of being burned, but I guess she is not.",
3/23/2021 20:16:29,elgkim@ucsc.edu,https://youtu.be/M-QcdHgJQwc,Male voice joins,,0:06:38,,"vlog, baking, new person",New person joins the room. Can't be seen in the video but emerges in the audio. Maybe her father? Tells her not to flip the pancake twice.,
3/23/2021 20:19:23,elgkim@ucsc.edu,https://youtu.be/M-QcdHgJQwc,"Loud music, chocolate starts burning",,0:06:57,0:07:11,"vlog, baking, accident, music","The chocolate that was on the stove starts burning. The music gets suddenly louder that matches the energy of the chaos in the kitchen. But the people in the room finds the situation funny. Also no tics in this situation, which makes me wonder why the creator did not show tics in this particular situation.",
3/23/2021 20:20:21,elgkim@ucsc.edu,https://youtu.be/M-QcdHgJQwc,almost touched the stove,,0:07:23,,"tics, Tourette, accident",almost touched the stove! Made my heart drop. The creator's too,
3/23/2021 20:22:03,elgkim@ucsc.edu,https://youtu.be/M-QcdHgJQwc,flips the pancake ,,0:08:06,,"baking, vlog",successfully flips the pancake without the spatula! Nervous but made me happy,
3/23/2021 20:24:19,elgkim@ucsc.edu,https://youtu.be/M-QcdHgJQwc,zoomed in editing style,,0:08:55,,video editing,"Repeatedly zooms in to  a part of the screen. This is an editing style that I see in vlogs often, usually to focus on a funny part of the scene. This makes me think that the creator does take part in the editing.",
3/23/2021 20:28:17,elgkim@ucsc.edu,https://youtu.be/M-QcdHgJQwc,drops the last pancake,,0:10:06,,"vlog, accident",flipping pancake gone wrong.. I don't think that this accident was because of a tic,
3/23/2021 20:29:34,elgkim@ucsc.edu,https://youtu.be/M-QcdHgJQwc,closing scene,,0:10:26,,"vlog, closing, Tourette, tics",The closing seemed to be cut short along with a clip of a tic. ,
3/25/2021 23:47:28,rmartasu@ucsc.edu,https://youtu.be/ZX4b1yZxkd0," Autism, Occupations, and Real Inclusion",,0:00:50,0:02:27,"Job Search, Workplace Accommodations, Gaslighting, Inclusivity, Autism","Tyla makes a core point here about trying to function as an autistic in a neurotypical society: ""When you're being held to a standard that accommodates a neuromajority, you're already at a disadvantage."" She implies that people who ""champion inclusivity"" often fail to understand this disadvantage because they believe that they too, to some extent, undergo the same challenges autistics do.",
3/25/2021 23:52:34,rmartasu@ucsc.edu,https://youtu.be/ZX4b1yZxkd0,Searching for Jobs & Accomodations w/ Autism,,0:02:25,0:03:59,"Autism Work Placement, Autism Jobs, Autism Apprenticeships, Job Searching, Workplace Accommodations","Tyla makes it clear that there are a lot of basic accommodations and grants and internships for disabilities like autism, but there aren't many for autistics who Do have work experience and need accommodations beyond a crisis level. A lot of society expects that any accommodation beyond initial help isn't an accommodation, but rather a nuisance. ",
3/26/2021 0:01:35,rmartasu@ucsc.edu,https://youtu.be/ZX4b1yZxkd0,"Imposter Syndrome, Your Job, and Anxiety",,0:04:50,0:07:00,"Imposter Syndrome, Competence, Autism, Workplace Accommodations, Flexibility ","AHHHHHHHHHH THIS Okay THIS IS LITERALLY WHAT IM STRUGGLING WITH IN GDA and even this research project. It's really easy to feel incompetent when you don't necessarily know what's expected of you  Maybe this could also really apply to ppl with PTSD or ACES?????

She's also mentioning how society seems to value generalists way over specialists and  how autistic people tend to be specialists-- literally just another barrier autistics need to overcome",
3/26/2021 0:06:23,rmartasu@ucsc.edu,https://youtu.be/ZX4b1yZxkd0,Maintaining a Network of People While Autistic,,0:07:00,0:07:46,"job search, autism, networking","that comment at the end abt messaging people out of the blue when you need something-- oop I didn't even realize that proper etiquette??? 

but also. extremely important point here how it's literally difficult for autistic ppl to keep a network but society expects you to have a strong network to get a job...",
3/26/2021 0:14:01,rmartasu@ucsc.edu,https://youtu.be/ZX4b1yZxkd0,Ignorant People & Autism,,0:10:10,0:11:10,"ignorance, learning, autism, empathy",I want to know where that unwillingness comes from. Sometimes I find it in myself and it's over stupid shit that I don't even think is worth dying for. I think people just naturally don't want to be wrong and it takes a lot of effort to become a person who's willing to change. will prolly write more on this,
3/26/2021 0:18:52,rmartasu@ucsc.edu,https://youtu.be/ZX4b1yZxkd0,Autism Relative to Society,https://drive.google.com/open?id=1_GZHhTaCxelkmyZUZUJ6D9a6mf8Q_3VT,,,"comments, society, autism, diagnoses",that last comment hits. a lot of mental disorders only have to be retroactively accommodated for because of the expectations we hold on people based on the way society is structured. a lot of these problems are inherently societal.,Yes
3/27/2021 19:12:29,elgkim@ucsc.edu,https://youtu.be/jZ4I4YI1j_A,disabled people rarely mentioned during movements,,0:00:55,,"rights, equality","Now that the creator mentions this, I realized that disabled people are rarely mention when it comes to equality movements. It makes me wonder why though..",
3/27/2021 19:15:46,elgkim@ucsc.edu,https://youtu.be/jZ4I4YI1j_A,"creator didn't know about the term ""ableism""",,0:01:28,,"ableism, term, rights","This creator did not know that the term ""ableism"" existed. To be honest, I didn't either until recently, but that really shows how much awareness that the public has about the disabled community, especially when someone from the disabled community didn't know about this term.",
3/27/2021 19:27:00,elgkim@ucsc.edu,https://youtu.be/jZ4I4YI1j_A,comparing publicity between sexism/racism/etc with ableism,,0:01:40,0:02:28,"publicity, ableism","This creator compares the publicity that the issue of sexism/racism/etc has compared to that of ableism. And like the creator has mentioned before, publicity about ableism is so limited that even the term is not well known. I can't think of a reason why this is happening at the moment..",
3/27/2021 19:29:48,elgkim@ucsc.edu,https://youtu.be/jZ4I4YI1j_A,"mentions living with a ""thick skin""",,0:02:37,,ableism,"The creator mentions living with a thick skin, which most likely means that she has had a lot of experience with ableism and rude behavior from other people. This makes me angrier in that despite what she was going through, she didn't even know there was a term for the discrimination?! This further supports how the limited education and awareness on ableism is an issue.",
3/27/2021 19:39:39,elgkim@ucsc.edu,https://youtu.be/jZ4I4YI1j_A,explaining dread from an anticipated moment,,0:03:05,,"ableism, dread","The creator feels oncoming dread for a situation that overlaps with school time (because a lot of kids will be present and there will be a lot of commentary). Experiencing the dread and anticipation for this kind of situation are not emotions that a person should not have to feel. Of course,  I will never be able to understand what she goes through, but dread and anticipation for the worst can bring stress and anxiety",
3/27/2021 19:44:07,elgkim@ucsc.edu,https://youtu.be/jZ4I4YI1j_A,definition of ableism,,0:03:35,,"ableism, word choice, definition","The creator defines ableism as ""discriminating and hating against someone because of what they can or can't do so hating against someone because they're unable to do certain things"". This is quite a specific definition, and Oxford Languages just simply defines ableism as ""discrimination in favor of able-bodied people"". I wonder if this specificity of the definition is influenced by her prior experiences. ",
3/27/2021 19:47:07,elgkim@ucsc.edu,https://youtu.be/jZ4I4YI1j_A,does not like the term,,0:03:51,,"ableism, term, dislike","The creator does not like the term ableism. I wonder why, but it's hard to come up with the reasons since I haven't personally experienced what they have gone through. How can we make this term better?",
3/27/2021 19:57:17,elgkim@ucsc.edu,https://youtu.be/jZ4I4YI1j_A,casting able-bodied people for disabled roles in media,,0:04:19,0:05:30,"media, ableism, casting, disabled roles","The creator dislikes how the media casts able-bodied actors for the roles of disabled characters. She finds this act to be offensive and disgusting, especially since they are pretending to live a life of a disabled person for the sake of a film. She specfically refers to the film ""Following Stars"". This was her favorite movie, and with the character being an amputee, I think that she would've looked up to the character. And I can't imagine the emotion of when she realized that the character wasn't actually an amputee (she genuinely believed that the actor was an amputee when she was younger). ",
3/27/2021 20:01:43,elgkim@ucsc.edu,https://youtu.be/jZ4I4YI1j_A,mentions a youtuber displaying ableism,,0:06:05,,"ableism, media, youtube","The creator watches a video who pretends to do tasks with no hands. For the creator, who has no hands, she finds this offensive and disrespectful as that youtuber was using the disability for the purpose of entertainment. I think this supports how people today are not informed and educated on ableism and the disabled community.",
3/27/2021 20:04:57,elgkim@ucsc.edu,https://youtu.be/jZ4I4YI1j_A,hate crimes illegal in the UK,,0:06:52,,"ableism, hate crime, UK",Creator had situations where she had the chance to report to the police. Why did she not? The fact that she mentions that she could've reported it means that the situation was pretty serious.,
3/27/2021 20:19:35,elgkim@ucsc.edu,https://youtu.be/jZ4I4YI1j_A,stereotypes about disability,,0:08:07,,"ableism, stereotype","Creator says the stereotype about disabled people has been used against her by people with and without disability. I think that this once again shows the lack of education about disabilities and the disabled community. If the people are taught to not stereotype, then the issue of discrimination could improve",
3/27/2021 20:22:23,elgkim@ucsc.edu,https://youtu.be/jZ4I4YI1j_A,missing out disabilities in equality movements,,0:09:39,,"ableism, absent, equality, movements",Mentions that disability rights are missed out on in the topic of equality. Been mentioned multiple times so far,
3/27/2021 20:26:29,elgkim@ucsc.edu,https://youtu.be/jZ4I4YI1j_A,resistant to talk about it before,,0:10:35,,"ableism, minority, speaking out",Says she felt resistant to talk about ableism before because the disabled community is a minority group. I wonder what pushed her to bring this topic up in her channel.,
3/27/2021 20:37:54,elgkim@ucsc.edu,https://youtu.be/jZ4I4YI1j_A,education is key,,0:11:17,,"education, ableism",Ableism and other discrimination could stem from the lack of education. Then that also means that educating society of these topics could be a solution to reduce ableism ,Yes
3/29/2021 12:16:31,raferrei@ucsc.edu,https://www.tiktok.com/@sky__0_o/video/6936829592367910149?lang=en&is_copy_url=0&is_from_webapp=v2&sender_device=pc&sender_web_id=6873965249407845894,Mute creator playing with TikTok trends,,,,"mute, Tiktok, trending, music, hashtag, ASL, audio","The creator makes a TikTok that plays with written words in the scree, font color, and light. I believe he uses ASL  but not necessarily sure if he is saying the same sentence that is floating on the screen. The audio had no editing, which means he did not use the usual music associated with this trend. This also means that his video is not linked to the rest of the trend by the music and his reach is compromised. Also, they use only one  hashtags and it does not match other's use of hashtag for this trend.",Yes
3/29/2021 22:23:29,raferrei@ucsc.edu,https://disabilityvisibilityproject.com/2021/03/10/my-year-of-nothing-but-everything/,Struggle of a physically dependent person during COVID,,,,"wheelchair, COVID, vaccine, ableism, equity, public health, coronavirus","In this first paragraph, Emily gives an a brief of how limited to certain locations and people her life was and how the pandemic took that from her and confined her in her one bedroom apartment. Her comment “as a person who has trouble surviving the common cold” shows how she disproportionally is affected by a regular cold and how the pandemic situation took a toll on her mental health and willingness or fear to go places. 
In the second paragraph, exposed a difficult reality for those who depend of others for their most basic personal needs. She previously had 10-15 personal care aides to help her with 6 hours of daily basic needs but their inability to isolate themselves presented a risk to Emily. This generated an internal conflict between getting infected and having her basic needs met. Like she said “for the first time ever in adulthood, I’ve found myself resentful and wishing for the ability to truly live independently without the need for assistance with my daily activities”.  This shows the constant mental exhaustion that she must have felt on top of having to face all the stress we all had to deal.",
3/30/2021 11:53:26,raferrei@ucsc.edu,https://disabilityvisibilityproject.com/2021/03/10/my-year-of-nothing-but-everything/,Vaccination priority and roll out,,,,"wheelchair, COVID, vaccine, ableism, equity, public health, coronavirus, ableism","Third paragraph points out the initial guidelines for vaccination did not consider people under 65 with high-risk to be the highest priority. This generated months of anxiety and when they finally moved people under 64 with high-risk to highest priority, Emily battle became to prove she was one of them to whoever was responsible for the vaccination. Lack of guidelines, information, proper procedure, and systematic ableism lead to Emily trying to prove she was in that group even though being of young age.
Fourth paragraph goes in detail how the state’s recognition of her need for early vaccination did not translate to accessible vaccination. Places responsible for distriburing vaccines had people entering their information to register for vaccination on demand and Emily’s compromised motor abilities made it extra difficult for her to fill out those forms quickly in order to guarantee a spot. Also, this same system would generate one day’s notice appointment which for someone who relies on others to almost everything is like she says “the disable nightmare”.",
3/30/2021 12:14:55,raferrei@ucsc.edu,https://disabilityvisibilityproject.com/2021/03/10/my-year-of-nothing-but-everything/,Systematic ableism when trying to get vaccinated,,,,"wheelchair, COVID, vaccine, ableism, equity, public health, coronavirus","Fifth and sixth paragraph show Emily’s continued battle to try to overcome the systematic ableism in trying to receive a vaccine which state of Pennsylvania had on paper that she was eligible to get. She brings up that young abled students were able to get vaccinated through a partnership between her university and the state because those students had contact with patients but she was still denied to receive her dose. Emily expose the difficulty to get an appointment through CVS since it was open to millions of people, the inability to get vaccinated through her school even though that was a much smaller set of eligible students, and the fact that private medical practitioners were overwhelmed by the general public and did not present a viable way for her to get her vaccine or even general information. She brings up how she saw the “shrug of responsibility from numerous institutions” when confronted about the lack of vaccination equity.",
3/31/2021 12:05:01,raferrei@ucsc.edu,https://disabilityvisibilityproject.com/2021/03/10/my-year-of-nothing-but-everything/,Use of Facebook and systemic bias during COVID,,,,"white supremacy, BIPOC, privatization, bias, ableism, COVID, Facebook","Paragraphs seven and eight expose some of the systematic ableism and overall inequality. Emily starts be sharing her use of the social media Facebook and a tool to connect and see shared experiences of others trying to get the vaccine, understand what is happening, or express joy for finally being vaccinated. Emily points out that Facebook became a double swarded resource since it helped her see the broader difficulties faced by different communities of her region and see that she was not alone but at the same time the Facebook group exposed “emotional extremes”. She points out that it was challenge to handle those emotional appeals online and it also revealed how disable lives overall were disproportionally left out since the beginning of quarantine. Emily includes BIPOC into her analyses of those left out and criticizes white supremacy as part of the US medical bias. Other spect Emily writes about is the “history of defunded public health in favor of privatization” which lead to poor infrastructure and unequal system is the exchange of the ultimate goal of profit which affected minorities disproportionally. Like she mentions, disable lives were not celebrated before and most likely will not receive recognition for their loses due to covid, being once more purposefully unseen by our society.",
3/31/2021 12:29:42,raferrei@ucsc.edu,https://disabilityvisibilityproject.com/2021/03/10/my-year-of-nothing-but-everything/,Internalized ableism and community importance,,,,"wheelchair, COVID, vaccine, ableism, equity, public health, coronavirus, confinement, BIPOC","The last four paragraphs expose the intersectionality and mutual support among marginalized communities and how important their mutual support is for their survival. Emily shares that she got her first dose on February 17th on a day’s notice opportunity that was 1.5 hours away from her. This is a clear demonstration of how inaccessible the process was. Emily had the help of a queer BIPOC to help her achieve her vaccination goal and how that same person was tested positive a few days later which put her in stress and made Emily feel bad for having asked that person to expose themselves and because of that they could have potentially exposed other. As Emely reports “anyone who lives independently dependently knows the internalized ableism that materializes as guilt for asking for too much from others” which gives us a peek of how ableism can manifest within a disable person which I imagine to be mentally challenging to deal with because on matter how she feels she still cannot change her condition. Another peek to a disable person journey during COVID, “asking the people I love to knowingly expose themselves while waiting for my test results was something I hope to never need to do again” this shows that a disable person who have been exposed still have to rely on someone willingness to take them to a testing site which also means willingness to expose themselves. Emily ends her letter by wishing that after the health and institutional disparities that the COVID situation helped expose will gain more national visibility even after the pandemic and hopefully trigger systematic changes. Lastly, she calls it the Year of Nothing but still recognizes her emotions, bedroom confinement, and marginalized communities as her everything during that challenging year.",
3/31/2021 20:00:25,elgkim@ucsc.edu,https://youtu.be/JAXO2o33M9g,"waking up, enters in wheelchair",,0:00:11,,"vlog, a day in life, wheelchair",The creator enters the living space in a wheelchair. The wheelchair is controlled by the controller. ,
3/31/2021 20:05:39,elgkim@ucsc.edu,https://youtu.be/JAXO2o33M9g,breakfast time,,0:00:16,,"wheelchair, vlog, a day in life",does not pick up the cup but scoots it toward her and drinks from a straw. Does her disability affect the mobility of her hand?,
3/31/2021 20:07:53,elgkim@ucsc.edu,https://youtu.be/JAXO2o33M9g,makeup time,,0:00:44,,"vlog, a day in life, make up",She does her make up well. Makeup requires fine motor skills and she seems apply the makeup accurately. She still scoots some of the makeup materials with her arms to move them around the desk,
3/31/2021 20:14:32,elgkim@ucsc.edu,https://youtu.be/JAXO2o33M9g,asks for help to open a makeup palette,,0:01:00,,"makeup, vlog, a day in life, help",Asks her husband for help to open up the palette. She uses her mouth to get the brush to where she wants to place it. ,
3/31/2021 20:17:24,elgkim@ucsc.edu,https://youtu.be/JAXO2o33M9g,"Arriving at desination, getting off the car",,0:01:56,,"vlog, a day in life, technology","She gets off the car using the ramp.  I knew about cars with this kind of technology, but this is my first time seeing one and how it's used.",
3/31/2021 20:19:17,elgkim@ucsc.edu,https://youtu.be/JAXO2o33M9g,son helps his mom,,0:02:03,,"vlog, a day in life, technology",The son helps to unclip the safety device from the wheelchair. I think that the clip is used to make sure that the wheelchair doesn't move during the travel  (for safety). It's cute to see the son helping!,
3/31/2021 20:21:55,elgkim@ucsc.edu,https://youtu.be/JAXO2o33M9g,At the fair/event (museum),,0:02:12,,"vlog, a day in life, stares","I see some people looking. Many do not probably because of the attractions, but some people stare as they pass by.",
3/31/2021 20:25:26,elgkim@ucsc.edu,https://youtu.be/JAXO2o33M9g,recording the crowd,,0:03:04,,"vlog, a day in life, stares",I see another person staring. Maybe there's an attraction behind the person recording. But this girl stares the entire clip!!,
3/31/2021 20:28:57,elgkim@ucsc.edu,https://youtu.be/JAXO2o33M9g,Christmas tree,,0:03:35,,"vlog, a day in life, pointing, stares","Recording the christmas tree. The woman points directly to the camera. I'm not sure where the creator is and what is behind the person holding the camera, so I cannot be sure as to what the woman is pointing at. But the pointing is so directly and obvious that I'm making eye contact with the woman.",
3/31/2021 20:34:49,elgkim@ucsc.edu,https://youtu.be/JAXO2o33M9g,wheelchair lift,,0:04:39,,"vlog, wheelchair lift, technology","They filmed a wheelchair lift. They didn't film it in motion, so I think that the creator wanted to make a statement. Seeing that this was the first one that they've filmed, this was probably the first one they've seen in the museum. Were they just simply showing that they had one, or were they trying to bring a negative/positive light onto the fact that there was one? Were they emphasizing that there WAS one or there was JUST one?",
3/31/2021 20:37:20,elgkim@ucsc.edu,https://youtu.be/JAXO2o33M9g,wheelchair section of the museum,,0:04:57,,"vlog, a day in life",briefly films a part of the museum that showed past wheelchair designs. I see the creator looking at the display shaking her head a bit as she responses to someone. Was this toward the wheelchair designs or was she just talking about something else?,
